ano,titulo,autores,link,motivo,resumo_pt,veredito_dc,explicacao_dc
2021,A tree-based multiclassification of breast tumor histopathology images through deep learning.,"Murtaza G, Abdul Wahab AW, Raza G, Shuib L",https://pubmed.ncbi.nlm.nih.gov/33545489/,"O estudo utiliza imagens de histopatologia em vez de mamografia, o que não atende aos critérios de inclusão.","O estudo desenvolve um modelo de classificação multiclassificação de tumores de mama usando imagens de histopatologia e deep learning. O modelo proposto alcançou uma precisão de classificação entre 87,50% e 100% para quatro subtipos de tumores. No entanto, não utiliza mamografia, que é um critério essencial para inclusão.",exclude,"A exclusão está correta, pois o estudo utiliza apenas imagens de histopatologia, que não se enquadram nos critérios de inclusão que exigem o uso de mamografia."
2021,Prospective assessment of breast cancer risk from multimodal multiview ultrasound images via clinically applicable deep learning.,"Qian X, Pei J, Zheng H, Xie X, Yan L, Zhang H, Han C, Gao X, Zhang H, Zheng W, Sun Q, Lu L, Shung KK",https://pubmed.ncbi.nlm.nih.gov/33875840/,"O estudo utiliza apenas imagens de ultrassom e não envolve mamografia, violando o critério de inclusão.","O estudo avalia a aplicação de um sistema de deep learning para classificar imagens de ultrassom da mama, mostrando que o modelo previu com precisão os escores BI-RADS. No entanto, não envolve mamografia, limitando sua relevância para a revisão.",exclude,"A exclusão está correta, pois o estudo utiliza apenas imagens de ultrassom, sem envolver mamografia, o que viola claramente os critérios de inclusão da revisão."
2021,VIRTUAL CLINICAL TRIALS IN MEDICAL IMAGING SYSTEM EVALUATION AND OPTIMISATION.,"Barufaldi B, Maidment ADA, Dustler M, Axelsson R, Tomic H, Zackrisson S, Tingberg A, Bakic PR",https://pubmed.ncbi.nlm.nih.gov/34144597/,"O estudo não apresenta dados de desempenho de algoritmos de Deep Learning aplicados a mamografia, focando em simulações e otimizações de sistemas de imagem.","O artigo discute o uso de ensaios clínicos virtuais (VCTs) para avaliar e otimizar sistemas de imagem médica, com ênfase na tomossíntese digital (DBT). O estudo compara leituras virtuais e clínicas, mas não apresenta resultados de algoritmos de Deep Learning aplicados a mamografias. O foco está na otimização da qualidade da imagem e não na aplicação de IA.",exclude,"O artigo se concentra em simulações e otimizações de sistemas de imagem, sem apresentar dados de desempenho de algoritmos de Deep Learning aplicados a mamografia, o que justifica a exclusão."
2021,Differential diagnosis of breast cancer assisted by S-Detect artificial intelligence system.,"Xia, Qun, Cheng, Yangmei, Hu, Jinhua, Huang, Juxia, Yu, Yi, Xie, Hongjuan, Wang, Jun",https://dx.doi.org/10.3934/mbe.2021184,"O estudo utiliza apenas imagens de ultrassom e não envolve mamografia, violando o critério de inclusão.","O estudo avaliou o valor diagnóstico assistido do sistema de inteligência artificial S-Detect na diferenciação entre massas benignas e malignas em imagens de ultrassom. Foram analisadas imagens convencionais e modos de S-Detect, com resultados mostrando alta sensibilidade e especificidade. No entanto, o foco em ultrassom exclui a inclusão na revisão.",exclude,"A exclusão está correta, pois o estudo utiliza apenas imagens de ultrassom, o que viola claramente o critério de inclusão que requer o uso de mamografia."
2021,Application of ultrasonic dual-mode artificially intelligent architecture in assisting radiologists with different diagnostic levels on breast masses classification.,"Li, Chunxiao, Li, Jiajun, Tan, Tao, Chen, Kun, Xu, Yi, Wu, Rong",https://www.ncbi.nlm.nih.gov/pmc/articles/PMC8136533,"O estudo utiliza apenas ultrassonografia e elastografia, sem envolver mamografia, o que viola os critérios de inclusão.","O estudo avaliou a performance diagnóstica de um sistema de inteligência artificial que integra informações de ultrassonografia e elastografia para classificação de tumores mamários. Os resultados mostraram melhorias na acurácia e na variabilidade entre observadores, especialmente entre radiologistas inexperientes. No entanto, não envolve mamografia, que é um critério essencial para inclusão.",exclude,"A exclusão está correta, pois o estudo se concentra exclusivamente em ultrassonografia e elastografia, sem envolver mamografia, o que viola claramente os critérios de inclusão da revisão."
2021,Application of deep learning to establish a diagnostic model of breast lesions using two-dimensional grayscale ultrasound imaging.,"Zhang, Nan, Li, Xiao-Ting, Ma, Lu, Fan, Zhao-Qing, Sun, Ying-Shi",https://dx.doi.org/10.1016/j.clinimag.2021.03.024,"O estudo utiliza apenas imagens de ultrassom e não envolve mamografia, violando o critério de inclusão.","O estudo desenvolveu um modelo de diagnóstico de lesões mamárias usando imagens de ultrassom bidimensionais e comparou seu desempenho com o de radiologistas. Os resultados mostraram que o modelo de IA teve uma acurácia de 77,0% e um AUC de 0,846. Apesar de um desempenho promissor, o estudo não aborda mamografia.",exclude,"A exclusão está correta, pois o estudo utiliza apenas imagens de ultrassom, o que viola claramente os critérios de inclusão que exigem o uso de mamografia."
2021,Artificial intelligence for breast ultrasound: An adjunct tool to reduce excessive lesion biopsy.,"Wang, Xin-Yi, Cui, Li-Gang, Feng, Jie, Chen, Wen",https://dx.doi.org/10.1016/j.ejrad.2021.109624,"O estudo utiliza apenas Ultrassom e não envolve mamografia, violando o critério de inclusão.","O estudo avaliou se a adição de um sistema de inteligência artificial ao ultrassom mamário poderia reduzir biópsias desnecessárias. Foram analisadas 173 lesões suspeitas, e os resultados mostraram que a taxa de biópsias poderia ser significativamente reduzida com a avaliação da IA. No entanto, o estudo não envolveu mamografia.",exclude,"A exclusão está correta, pois o estudo se concentra exclusivamente em Ultrassom e não envolve mamografia, o que viola claramente os critérios de inclusão da revisão."
2021,Optimized Radial Basis Neural Network for Classification of Breast Cancer Images.,"Rajathi, G M",https://dx.doi.org/10.2174/1573405616666200516172118,"O estudo utiliza uma rede neural de base radial (RBNN) e menciona imagens de ressonância magnética (MRI) em vez de mamografia, o que não atende aos critérios de inclusão.","O estudo propõe uma rede neural de base radial otimizada para classificar imagens de câncer de mama, utilizando um algoritmo de otimização. Embora mencione a mamografia, o foco principal está em imagens de MRI, o que não se alinha aos critérios da revisão. O desempenho do classificador é avaliado com métricas como precisão e recall.",exclude,"A exclusão está correta, pois o estudo utiliza imagens de ressonância magnética (MRI), que não se enquadra nos critérios de inclusão que especificam o uso de mamografia."
2021,Consideraciones bioéticas en relación con el uso de la inteligencia artificial en mastología,"Actis, Andrea Mariel",http://www.scielo.edu.uy/scielo.php?script=sci_arttext&pid=S1688-03902021000401502&lng=es&nrm=iso&tlng=es,O artigo é uma reflexão bioética e não apresenta dados de pesquisa ou métricas de performance sobre o uso de IA em mamografia.,"O artigo discute considerações bioéticas relacionadas ao uso de inteligência artificial na mastologia, abordando as vantagens e limitações da tecnologia no screening mamográfico. No entanto, não apresenta dados de pesquisa ou resultados sobre a eficácia da IA na detecção de câncer de mama.",exclude,"O artigo é uma reflexão bioética e não apresenta dados de pesquisa ou métricas de performance, violando claramente os critérios de inclusão."
